{
  "meta": {
    "runName": "demo-run",
    "schemaVersion": 1,
    "specRef": "specs/<spec-name>.md",
    "standardsRef": "CODING_STANDARDS.md",
    "baseBranch": "main",
    "integrationBranch": "fleet/demo-run/int"
  },
  "tracker": { "type": "local-md", "supportsBlocking": true },
  "nodes": [
    {
      "id": "t1",
      "ticket": { "ref": "tickets/t1.md", "title": "<ticket-title>" },
      "dependsOn": [],
      "routing": {
        "failureTolerance": "standard",
        "worker": "worker",
        "reviewer": "worker",
        "checkCommand": "npm test -- t1"
      },
      "runtime": {
        "status": "pending",
        "fixAttempt": 0,
        "handoverAttempt": 0,
        "branch": "fleet/demo-run/task/d1/t1",
        "commitSha": null,
        "acceptanceResult": null,
        "agentId": null
      },
      "sync": { "mirrored": false, "pushed": false },
      "attributes": {},
      "audit": []
    },
    {
      "id": "t2",
      "ticket": { "ref": "tickets/t2.md", "title": "<ticket-title>" },
      "dependsOn": ["t1"],
      "routing": {
        "failureTolerance": "standard",
        "worker": "worker",
        "reviewer": "worker",
        "checkCommand": "npm test -- t2"
      },
      "runtime": {
        "status": "pending",
        "fixAttempt": 0,
        "handoverAttempt": 0,
        "branch": "fleet/demo-run/task/d1/t2",
        "commitSha": null,
        "acceptanceResult": null,
        "agentId": null
      },
      "sync": { "mirrored": false, "pushed": false },
      "attributes": {},
      "audit": []
    }
  ],
  "stopFlag": { "stopped": false, "reason": null, "stoppedAt": null }
}
